{
  "player": "Móses",
  "slug": "moses",
  "summary": {
    "score_median": 1497,
    "rank": 18,
    "win_rate": 48.387097,
    "games": 31,
    "strongest_tier": "Medium"
  },
  "history": [
    {
      "date": "2026-02-19",
      "score_median": 1519,
      "score_q25": 1487,
      "score_q75": 1559,
      "score_lower": 1437,
      "score_upper": 1630,
      "rank": 11,
      "win_rate": 62.5,
      "games": 8,
      "wins": 5,
      "losses": 3,
      "strength": {
        "High": -0.027476,
        "Medium": 0.07065,
        "Low": -0.022979,
        "Other": -0.024929
      }
    },
    {
      "date": "2026-02-26",
      "score_median": 1516,
      "score_q25": 1486,
      "score_q75": 1553,
      "score_lower": 1438,
      "score_upper": 1622,
      "rank": 12,
      "win_rate": 62.5,
      "games": 8,
      "wins": 5,
      "losses": 3,
      "strength": {
        "High": -0.023774,
        "Medium": 0.072119,
        "Low": -0.025575,
        "Other": -0.024042
      }
    },
    {
      "date": "2026-03-05",
      "score_median": 1502,
      "score_q25": 1476,
      "score_q75": 1529,
      "score_lower": 1428,
      "score_upper": 1582,
      "rank": 17,
      "win_rate": 50,
      "games": 16,
      "wins": 8,
      "losses": 8,
      "strength": {
        "High": -0.091166,
        "Medium": 0.104399,
        "Low": -0.005186,
        "Other": -0.003434
      }
    },
    {
      "date": "2026-03-19",
      "score_median": 1503,
      "score_q25": 1480,
      "score_q75": 1530,
      "score_lower": 1439,
      "score_upper": 1579,
      "rank": 17,
      "win_rate": 52.173913,
      "games": 23,
      "wins": 12,
      "losses": 11,
      "strength": {
        "High": -0.100888,
        "Medium": 0.120111,
        "Low": -0.009066,
        "Other": -0.008155
      }
    },
    {
      "date": "2026-03-26",
      "score_median": 1503,
      "score_q25": 1480,
      "score_q75": 1529,
      "score_lower": 1441,
      "score_upper": 1580,
      "rank": 17,
      "win_rate": 52.173913,
      "games": 23,
      "wins": 12,
      "losses": 11,
      "strength": {
        "High": -0.097536,
        "Medium": 0.119622,
        "Low": -0.011318,
        "Other": -0.006452
      }
    },
    {
      "date": "2026-04-04",
      "score_median": 1503,
      "score_q25": 1484,
      "score_q75": 1527,
      "score_lower": 1445,
      "score_upper": 1576,
      "rank": 18,
      "win_rate": 52.173913,
      "games": 23,
      "wins": 12,
      "losses": 11,
      "strength": {
        "High": -0.091011,
        "Medium": 0.115564,
        "Low": -0.013754,
        "Other": -0.014301
      }
    },
    {
      "date": "2026-04-09",
      "score_median": 1504,
      "score_q25": 1483,
      "score_q75": 1530,
      "score_lower": 1442,
      "score_upper": 1582,
      "rank": 18,
      "win_rate": 52.173913,
      "games": 23,
      "wins": 12,
      "losses": 11,
      "strength": {
        "High": -0.091639,
        "Medium": 0.116107,
        "Low": -0.010949,
        "Other": -0.011658
      }
    },
    {
      "date": "2026-04-16",
      "score_median": 1504,
      "score_q25": 1483,
      "score_q75": 1530,
      "score_lower": 1444,
      "score_upper": 1581,
      "rank": 18,
      "win_rate": 52.173913,
      "games": 23,
      "wins": 12,
      "losses": 11,
      "strength": {
        "High": -0.090037,
        "Medium": 0.111749,
        "Low": -0.008266,
        "Other": -0.014436
      }
    },
    {
      "date": "2026-04-23",
      "score_median": 1503,
      "score_q25": 1482,
      "score_q75": 1530,
      "score_lower": 1440,
      "score_upper": 1583,
      "rank": 18,
      "win_rate": 52.173913,
      "games": 23,
      "wins": 12,
      "losses": 11,
      "strength": {
        "High": -0.089958,
        "Medium": 0.114179,
        "Low": -0.007372,
        "Other": -0.014895
      }
    },
    {
      "date": "2026-04-30",
      "score_median": 1505,
      "score_q25": 1482,
      "score_q75": 1534,
      "score_lower": 1440,
      "score_upper": 1586,
      "rank": 18,
      "win_rate": 52.173913,
      "games": 23,
      "wins": 12,
      "losses": 11,
      "strength": {
        "High": -0.089938,
        "Medium": 0.114818,
        "Low": -0.009447,
        "Other": -0.016995
      }
    },
    {
      "date": "2026-05-07",
      "score_median": 1506,
      "score_q25": 1481,
      "score_q75": 1536,
      "score_lower": 1437,
      "score_upper": 1593,
      "rank": 17,
      "win_rate": 52.173913,
      "games": 23,
      "wins": 12,
      "losses": 11,
      "strength": {
        "High": -0.093627,
        "Medium": 0.112633,
        "Low": -0.009635,
        "Other": -0.009586
      }
    },
    {
      "date": "2026-05-14",
      "score_median": 1499,
      "score_q25": 1476,
      "score_q75": 1522,
      "score_lower": 1434,
      "score_upper": 1568,
      "rank": 18,
      "win_rate": 48.387097,
      "games": 31,
      "wins": 15,
      "losses": 16,
      "strength": {
        "High": -0.071352,
        "Medium": 0.139208,
        "Low": -0.065148,
        "Other": 0.001506
      }
    },
    {
      "date": "2026-05-21",
      "score_median": 1498,
      "score_q25": 1475,
      "score_q75": 1522,
      "score_lower": 1432,
      "score_upper": 1567,
      "rank": 18,
      "win_rate": 48.387097,
      "games": 31,
      "wins": 15,
      "losses": 16,
      "strength": {
        "High": -0.075402,
        "Medium": 0.1349,
        "Low": -0.06046,
        "Other": 0.004393
      }
    },
    {
      "date": "2026-05-28",
      "score_median": 1498,
      "score_q25": 1475,
      "score_q75": 1521,
      "score_lower": 1430,
      "score_upper": 1568,
      "rank": 18,
      "win_rate": 48.387097,
      "games": 31,
      "wins": 15,
      "losses": 16,
      "strength": {
        "High": -0.076107,
        "Medium": 0.129832,
        "Low": -0.057655,
        "Other": 0.004026
      }
    },
    {
      "date": "2026-06-04",
      "score_median": 1498,
      "score_q25": 1475,
      "score_q75": 1522,
      "score_lower": 1431,
      "score_upper": 1566,
      "rank": 18,
      "win_rate": 48.387097,
      "games": 31,
      "wins": 15,
      "losses": 16,
      "strength": {
        "High": -0.074831,
        "Medium": 0.131984,
        "Low": -0.057308,
        "Other": 0.005284
      }
    },
    {
      "date": "2026-06-11",
      "score_median": 1498,
      "score_q25": 1475,
      "score_q75": 1520,
      "score_lower": 1434,
      "score_upper": 1565,
      "rank": 18,
      "win_rate": 48.387097,
      "games": 31,
      "wins": 15,
      "losses": 16,
      "strength": {
        "High": -0.07968,
        "Medium": 0.135067,
        "Low": -0.06149,
        "Other": 0.005523
      }
    },
    {
      "date": "2026-06-18",
      "score_median": 1498,
      "score_q25": 1476,
      "score_q75": 1519,
      "score_lower": 1437,
      "score_upper": 1562,
      "rank": 18,
      "win_rate": 48.387097,
      "games": 31,
      "wins": 15,
      "losses": 16,
      "strength": {
        "High": -0.075477,
        "Medium": 0.131442,
        "Low": -0.063203,
        "Other": 0.009083
      }
    },
    {
      "date": "2026-06-25",
      "score_median": 1498,
      "score_q25": 1475,
      "score_q75": 1521,
      "score_lower": 1434,
      "score_upper": 1565,
      "rank": 18,
      "win_rate": 48.387097,
      "games": 31,
      "wins": 15,
      "losses": 16,
      "strength": {
        "High": -0.078665,
        "Medium": 0.136806,
        "Low": -0.059957,
        "Other": -0.001812
      }
    },
    {
      "date": "2026-07-02",
      "score_median": 1498,
      "score_q25": 1474,
      "score_q75": 1523,
      "score_lower": 1430,
      "score_upper": 1570,
      "rank": 18,
      "win_rate": 48.387097,
      "games": 31,
      "wins": 15,
      "losses": 16,
      "strength": {
        "High": -0.077256,
        "Medium": 0.138976,
        "Low": -0.060277,
        "Other": 0.000198
      }
    },
    {
      "date": "2026-07-09",
      "score_median": 1497,
      "score_q25": 1472,
      "score_q75": 1522,
      "score_lower": 1426,
      "score_upper": 1572,
      "rank": 18,
      "win_rate": 48.387097,
      "games": 31,
      "wins": 15,
      "losses": 16,
      "strength": {
        "High": -0.073327,
        "Medium": 0.135731,
        "Low": -0.057103,
        "Other": -0.005077
      }
    }
  ],
  "cubes": [
    {
      "cube": "Vintage Aron",
      "tier": "High",
      "wins": 3,
      "losses": 5,
      "games": 8,
      "win_rate": 38,
      "trophies": 0
    },
    {
      "cube": "Flashdance!",
      "tier": "Medium",
      "wins": 4,
      "losses": 3,
      "games": 7,
      "win_rate": 57,
      "trophies": 0
    },
    {
      "cube": "Horror Cube",
      "tier": "Medium",
      "wins": 5,
      "losses": 3,
      "games": 8,
      "win_rate": 62,
      "trophies": 0
    },
    {
      "cube": "Pauper Cube Victor",
      "tier": "Low",
      "wins": 3,
      "losses": 5,
      "games": 8,
      "win_rate": 38,
      "trophies": 0
    }
  ]
}
